{
  "schemaVersion": "0.1.0",
  "kind": "manifest",
  "id": "io.github.theboyyss.invalidassetpaths",
  "name": "Invalid Asset Paths",
  "version": "0.1.0",
  "game": "falloutnv",
  "registries": {
    "dependencies": "src/registries/dependencies/",
    "capabilities": "src/registries/capabilities/",
    "assets": "src/registries/assets/"
  }
}
